<?xml version="1.0" encoding="iso-8859-9"?>
<yali xmlns:xsi="http://www.w3.org/2001/XMLSchema-instance" xsi:noNamespaceSchemaLocation="yalisema.xsd">
    <language>tr</language>
    <keymap>tr</keymap>
    <variant>q</variant>
    <root_password>pardusman</root_password>
    <hostname>pardus-kickstart</hostname>
    <!-- <users use_yali_first_boot="true"> -->
    <users>
        <user>
            <username>gokmen</username>
            <realname>gokmen goksel</realname>
            <password>1231111</password>
            <groups>audio,dialout,disk,pnp,pnpadmin,users,video,wheel</groups>
        </user>
        <user>
            <username>zeynep</username>
            <realname>zeynep sagar</realname>
            <password>123456</password>
            <groups>users,wheel,pnp</groups>
        </user>
        <!-- Wrong usage; root is unique user name 
        <user>
            <username>root</username>
            <realname>root user</realname>
            <password>123456</password>
            <groups>users,wheel,pnp</groups>
        </user>
        -->
    </users>
    <reponame>pardus-2007.3</reponame>
    <repoaddr>http://paketler.pardus.org.tr/pardus-remote-install/pisi-index.xml.bz2</repoaddr>
    <!--<partitioning partitioning_type="auto">disk0</partitioning>-->
    <partitioning partitioning_type="smartAuto">disk0</partitioning>
</yali>
